{
  "lang": "tr",
  "name": "Federal Coffee İstanbul",
  "country": "Türkiye",
  "city": "İstanbul",
  "address": "Tomtom Mah., Beyoğlu",
  "description": "Karaköy'de uzaktan çalışanların ve dijital göçebelerin sevdiği geniş bir kafe.",
  "name_i18n": { "en": "Federal Coffee Istanbul" },
  "country_i18n": { "en": "Türkiye" },
  "city_i18n": { "en": "Istanbul" },
  "description_i18n": { "en": "Spacious cafe in Karaköy popular with remote workers and digital nomads." },
  "type": "cafe",
  "rating": { "wifi": 4, "power": 3, "noise": 3, "comfort": 4 },
  "hours": "Pzt-Paz 08:00-22:00",
  "price": "$$",
  "tags": ["specialty-coffee", "laptop-friendly", "brunch"],
  "links": {
    "google_maps": "https://maps.google.com/?q=Federal+Coffee+Istanbul",
    "instagram": "https://instagram.com/federalcoffeecompany",
    "website": "https://federalcoffee.com.tr"
  },
  "coords": { "lat": 41.0322, "lng": 28.9774 },
  "submitted_by": "furkansenharputlu"
}
