{
  "lang": "tr",
  "name": "Walter's Coffee Roastery",
  "country": "Türkiye",
  "city": "İstanbul",
  "address": "Caferağa, Kadıköy",
  "description": "Anadolu yakasında Breaking Bad temalı kavurma atölyesi. Sert kahve, fena olmayan wifi.",
  "country_i18n": { "en": "Türkiye" },
  "city_i18n": { "en": "Istanbul" },
  "description_i18n": { "en": "Breaking-Bad themed roastery on the Asian side. Strong coffee, decent wifi." },
  "type": "cafe",
  "rating": { "wifi": 4, "power": 4, "noise": 3, "comfort": 4 },
  "hours": "Pzt-Paz 09:00-23:00",
  "price": "$$",
  "tags": ["themed", "roastery", "laptop-friendly"],
  "links": {
    "google_maps": "https://maps.google.com/?q=Walter%27s+Coffee+Roastery+Kadikoy",
    "instagram": "https://instagram.com/walterscoffeeroastery"
  },
  "coords": { "lat": 40.9889, "lng": 29.0258 },
  "submitted_by": "furkansenharputlu"
}
